{
  "id": "partii_fifo_lifo",
  "kind": "РН",
  "section": "оперативный",
  "skill": "Списание себестоимости по партиям (FIFO/LIFO), упорядоченное по моменту регистратора; метод задаётся учётной политикой на год.",
  "requires_context": [
    "оптовая торговля; документы Приходная/Расходная накладная",
    "складской учёт не ведётся"
  ],
  "contributes": {
    "objects": [
      "Перечисление МетодСписанияСебестоимости {ФИФО, ЛИФО}",
      "Периодический РегистрСведений УчётнаяПолитика (период — год)",
      "Измерение Партия в регистре остатков (по регистратору-приходу)"
    ],
    "changes": [
      "Списание себестоимости — по партиям; метод зависит от действующей на год учётной политики"
    ]
  },
  "traps": [
    {
      "lure": "Партия → Справочник",
      "correct": "Партия → измерение РегистраНакопления по регистратору (ДокументСсылка.ПриходнаяНакладная)",
      "why": "Партия идентифицируется документом-приходом; отдельная сущность-справочник не нужна."
    },
    {
      "lure": "Метод списания (ФИФО/ЛИФО) → реквизит документа",
      "correct": "Метод → ресурс периодического РегистраСведений УчётнаяПолитика",
      "why": "Учётная политика действует год и на следующий год может смениться — нужна периодичность, а не реквизит документа."
    },
    {
      "lure": "Себестоимость/Стоимость → реквизит справочника Номенклатура",
      "correct": "Стоимость → ресурс РегистраНакопления ОстаткиТоваров",
      "why": "Себестоимость — накапливаемая по партиям величина, а не свойство номенклатуры."
    },
    {
      "lure": "УчётнаяПолитика → константа или непериодический РС",
      "correct": "Периодический РегистрСведений (период — год)",
      "why": "Значение меняется по годам, нужно хранить историю по периодам."
    }
  ],
  "tolerance": {
    "required_objects": [
      { "role": "перечисление метода", "object_kind": "Перечисление" },
      { "role": "учётная политика", "object_kind": "РегистрСведений" },
      { "role": "остатки товаров", "object_kind": "РегистрНакопления" },
      { "role": "приход", "object_kind": "Документ" },
      { "role": "расход", "object_kind": "Документ" },
      { "role": "номенклатура", "object_kind": "Справочник" }
    ],
    "required_structure": [
      { "object": "ОстаткиТоваров", "dimensions": ["Номенклатура", "Партия"], "resources": ["Количество", "Стоимость"] }
    ],
    "allowed": [
      "Доп. реквизиты Номенклатуры (артикул, ед. изм.)",
      "Ресурс Сумма в табличных частях документов",
      "Отдельный регистр оборотов под отчёт продаж"
    ],
    "disqualifiers": [
      "Партия как отдельный справочник",
      "Отсутствие измерения Партия в регистре остатков",
      "Метод списания как реквизит документа вместо периодического РС"
    ]
  },
  "levels": {
    "1": { "projection": "Классифицируй сущности по видам объектов 1С", "grade": "точное_множество" },
    "2": { "projection": "Собери измерения и ресурсы регистра ОстаткиТоваров", "grade": "обязательное_ядро" },
    "3": { "projection": "Движения документов и алгоритм списания по партиям", "grade": "эталон_поведение", "modes": ["декларатив", "код", "поведение"] }
  },
  "render": {
    "nomenclature_pool": ["Кабель ВВГ 3х2.5", "Розетка двойная", "Светильник LED 36Вт", "Автомат C16", "Гофра 20мм"],
    "period_pool": ["I квартал", "II квартал", "полугодие"],
    "qty_range": [1, 12],
    "price_range": [30, 1500],
    "scaffold_template": "Компания ведёт оптовую торговлю. Поступление — «Приходная накладная», продажа — «Расходная накладная». Складской учёт не ведётся. Списание себестоимости — по партиям; метод (ФИФО/ЛИФО) определяется учётной политикой на год."
  },
  "model": {
    "kind": "РН",
    "objects": [
      { "name": "Номенклатура", "object_kind": "Справочник", "fields": [] },
      { "name": "МетодСписанияСебестоимости", "object_kind": "Перечисление", "values": ["ФИФО", "ЛИФО"] },
      {
        "name": "УчётнаяПолитика", "object_kind": "РегистрСведений", "subtype": "периодический(год)",
        "fields": [ { "name": "МетодСписания", "type": "ПеречислениеСсылка.МетодСписанияСебестоимости", "role": "ресурс" } ]
      },
      {
        "name": "ПриходнаяНакладная", "object_kind": "Документ",
        "tabular_sections": [ { "name": "Товары", "fields": ["Номенклатура", "Количество", "Цена", "Сумма"] } ]
      },
      {
        "name": "РасходнаяНакладная", "object_kind": "Документ",
        "tabular_sections": [ { "name": "Товары", "fields": ["Номенклатура", "Количество", "Цена", "Сумма"] } ]
      }
    ],
    "register": {
      "name": "ОстаткиТоваров", "subtype": "остатки",
      "dimensions": [
        { "name": "Номенклатура", "type": "СправочникСсылка.Номенклатура", "role": "измерение" },
        { "name": "Партия", "type": "ДокументСсылка.ПриходнаяНакладная", "role": "измерение" }
      ],
      "resources": [
        { "name": "Количество", "type": "Число", "role": "ресурс" },
        { "name": "Стоимость", "type": "Число", "role": "ресурс" }
      ]
    },
    "movements": [
      { "document": "ПриходнаяНакладная", "records": [ { "kind": "Приход", "resources": { "Количество": "ТЧ.Количество", "Стоимость": "ТЧ.Сумма" } } ] },
      { "document": "РасходнаяНакладная", "records": [ { "kind": "Расход", "algorithm_id": "списание_по_партиям_FIFO_LIFO" } ] }
    ]
  }
}
